MCQ,Choices,Correct
What is machine learning?,a: The study of statistical algorithms that can perform tasks without explicit instructions | b: The study of artificial intelligence concerned with the development of computer games | c: The study of mathematical optimization methods for data analysis | d: The study of exploratory data analysis through unsupervised learning,a
Who coined the term 'machine learning'?,a: Arthur Samuel | b: Donald Hebb | c: Walter Pitts | d: Warren McCulloch,a
What was the first machine learning model introduced by Arthur Samuel?,a: A program that calculated the winning chance in checkers | b: A program that analyzed sonar signals | c: A program that recognized patterns in speech patterns | d: A program that classified data based on computer vision of moles,a
What is the objective of modern-day machine learning?,a: To develop models for classifying data | b: To make predictions for future outcomes | c: Both a and b | d: Neither a nor b,c
In which field has machine learning been applied?,a: Computer vision | b: Speech recognition | c: Email filtering | d: All of the above,d
